id,source,feedback,date,sentiment_score,sentiment_label
1,Ecommerce,Delivery was late but packaging was excellent,2025-01-01,0.35,Positive
2,Survey,The nurse was very caring but waiting time was long,2025-01-02,0.07500000000000001,Positive
3,Social,Love the new website experience,2025-01-03,0.3181818181818182,Positive
4,Ecommerce,Checkout process was confusing on mobile,2025-01-04,-0.3,Negative
5,Survey,Customer service resolved my issue quickly,2025-01-05,0.3333333333333333,Positive
6,Social,App keeps crashing after update,2025-01-06,0.0,Neutral
